R640579,10.1038/s41598-023-31412-2,Evaluating the use of large language model in identifying top research questions in gastroenterology,2023,,R277,Computational Engineering,R603969,Contribution,https://www.nature.com/articles/s41598-023-31412-2,No Research Problem,No Research Problem,A. Lahat,E. Shachar,B. Avidan,Z. Shatz,Benjamin S. Glicksberg,E. Klang,,,,,,,,,,,,,,,,,,,,,,,,,,,,,,,,,,,,,,,,,,,,,,,,,,,,,,,,,,,,,,,,,,,,,,,,,,,,,,,,,,,,,,,,,,,,
R753856,10.1140/epjds/s13688-024-00467-0,Multifaceted online coordinated behavior in the 2020 US presidential election,2024,EPJ Data Science,R278,Information Science,R603969,Contribution,http://dx.doi.org/10.1140/epjds/s13688-024-00467-0,R753618,cordinated behavior of the accounts,Serena Tardelli,Leonardo Nizzoli,Marco Avvenuti,Stefano Cresci,Maurizio Tesconi,,,,,,,,,,,,,,,,,,,,,,,,,,,,,,,,,,,,,,,,,,,,,,,,,,,,,,,,,,,,,,,,,,,,,,,,,,,,,,,,,,,,,,,,,,,,,
R143720,10.1038/s41598-017-06064-8,Highly Efficient Non-Enzymatic Glucose Sensor Based on CuO Modified Vertically-Grown ZnO Nanorods on Electrode,2017,Scientific Reports,R279,Nanoscience and Nanotechnology,R603969,Contribution,https://www.nature.com/articles/s41598-017-06064-8,R143723,Development of Glucose Sensors Based on Nanomaterials,Rafiq Ahmad,Nirmalya Tripathy,Min-Sang Ahn,Kiesar Sideeq Bhat,Tahmineh Mahmoudi,Yousheng Wang,Jin-Young Yoo,Dae-Wook Kwon,Hwa-Young Yang,Yoon-Bong Hahn,,,,,,,,,,,,,,,,,,,,,,,,,,,,,,,,,,,,,,,,,,,,,,,,,,,,,,,,,,,,,,,,,,,,,,,,,,,,,,,,,,,,,,,,
R148131,10.1186/1471-2105-10-349,Construction of an annotated corpus to support biomedical information extraction,2009,BMC Bioinformatics,R322,Computational Linguistics,R603969,Contribution,https://link.springer.com/article/10.1186/1471-2105-10-349,R147583,Scientific concept annotation,Paul Thompson,Syed A Iqbal,John McNaught,Sophia Ananiadou,,,,,,,,,,,,,,,,,,,,,,,,,,,,,,,,,,,,,,,,,,,,,,,,,,,,,,,,,,,,,,,,,,,,,,,,,,,,,,,,,,,,,,,,,,,,,,
R148039,10.1186/1471-2105-6-s1-s3,GENETAG: a tagged corpus for gene/protein named entity recognition,2005,BMC Bioinformatics,R322,Computational Linguistics,R603969,Contribution,https://bmcbioinformatics.biomedcentral.com/articles/10.1186/1471-2105-6-S1-S3,R76427,Language resource,Lorraine Tanabe,Natalie Xie,Lynne H Thom,Wayne Matten,W John Wilbur,,,,,,,,,,,,,,,,,,,,,,,,,,,,,,,,,,,,,,,,,,,,,,,,,,,,,,,,,,,,,,,,,,,,,,,,,,,,,,,,,,,,,,,,,,,,,
R172170,10.1007/s40881-021-00105-9,Are women more generous than men? A meta-analysis,2021,Journal of the Economic Science Association,R303,Behavioral Economics,R603969,Contribution,http://dx.doi.org/10.1007/s40881-021-00105-9,No Research Problem,No Research Problem,David Bilén,Anna Dreber,Magnus Johannesson,,,,,,,,,,,,,,,,,,,,,,,,,,,,,,,,,,,,,,,,,,,,,,,,,,,,,,,,,,,,,,,,,,,,,,,,,,,,,,,,,,,,,,,,,,,,,,,
R609861,10.1007/s10549-022-06828-5,"Changes in the survival of patients with breast cancer: Poland, 2000–2019",2022,,R33,Epidemiology,R603969,Contribution,http://dx.doi.org/10.1007/s10549-022-06828-5,R609863,estimate breast cancer survival,Florentino Luciano Caetano dos Santos,Irmina Maria Michalek,Urszula Wojciechowska,Joanna Didkowska,,,,,,,,,,,,,,,,,,,,,,,,,,,,,,,,,,,,,,,,,,,,,,,,,,,,,,,,,,,,,,,,,,,,,,,,,,,,,,,,,,,,,,,,,,,,,,